{
  "pipeline": "film-evaluator-m-v1",
  "stage": "P1",
  "capacity": "M",
  "model": {
    "state_count": 30,
    "width": 256,
    "latent_dim": 64,
    "prepare_blocks": 3,
    "evaluate_blocks": 6,
    "fourier_bands": 5
  },
  "steps": 25000,
  "batch_size": 8,
  "learning_rate": 0.0002,
  "validation_interval": 500,
  "checkpoint_interval": 500,
  "minimum_steps": 4000,
  "early_stopping_patience": 6,
  "seed": 20260824,
  "device": "cuda",
  "deterministic": true
}
