{
  "pipeline": "film-evaluator-l-v1",
  "stage": "P1",
  "capacity": "L",
  "model": {
    "state_count": 30,
    "width": 512,
    "latent_dim": 128,
    "prepare_blocks": 3,
    "evaluate_blocks": 8,
    "fourier_bands": 6
  },
  "steps": 25000,
  "batch_size": 2,
  "learning_rate": 0.0001,
  "validation_interval": 500,
  "checkpoint_interval": 500,
  "minimum_steps": 4000,
  "early_stopping_patience": 6,
  "seed": 20260824,
  "device": "cuda",
  "deterministic": true
}
