{
  "pipeline": "analytic-residual-s-v1",
  "stage": "P1",
  "capacity": "S",
  "model": {
    "state_count": 30,
    "width": 128,
    "latent_dim": 32,
    "prepare_blocks": 2,
    "evaluate_blocks": 3,
    "fourier_bands": 4
  },
  "steps": 8,
  "batch_size": 2,
  "learning_rate": 0.0003,
  "validation_interval": 4,
  "checkpoint_interval": 4,
  "minimum_steps": 0,
  "early_stopping_patience": 2,
  "seed": 20260824,
  "device": "cuda",
  "deterministic": true
}
